Website,Section,Relevant Sentences,Classification from Model,,,
Superhuman,"In certain circumstances we may share your Personal Data with third parties without further notice to you, unless required by the law, as set forth below:

Vendors and Service Providers: To assist us in meeting business operations needs and to perform certain services and functions, we may share Personal Data with service providers, including web hosting, debugging services, email and productivity services, survey providers, data base and sales/customer relationship management services, customer service providers, payment processors; web and app analytics services, and data brokers. Notwithstanding the foregoing, we only share Email Content Data with our hosting provider (Google, Inc.). Pursuant to our instructions, these parties will access, process or store Personal Data in the course of performing their duties to us.
Business Transfers: If we are involved in a merger, acquisition, financing due diligence, reorganization, bankruptcy, receivership, sale of all or a portion of our assets, or transition of service to another provider, your Personal Data and other information may be shared in the diligence process with counterparties and others assisting with the transaction and transferred to a successor or affiliate as part of that transaction along with other assets.
Legal Requirements: If required to do so by law or in the good faith belief that such action is necessary to (i) comply with legal or regulatory obligations, (ii) protect and defend our rights or property, (iii) prevent fraud, (iv) act in urgent circumstances to protect the personal safety of users of the Site, or the public, or (v) protect against legal liability.","In certain circumstances we may share your Personal Data with third parties without further notice to you, unless required by the law, as set forth below:

Vendors and Service Providers: To assist us in meeting business operations needs and to perform certain services and functions, we may share Personal Data with service providers, including web hosting, debugging services, email and productivity services, survey providers, data base and sales/customer relationship management services, customer service providers, payment processors; web and app analytics services, and data brokers. Notwithstanding the foregoing, we only share Email Content Data with our hosting provider (Google, Inc.). Pursuant to our instructions, these parties will access, process or store Personal Data in the course of performing their duties to us.
Business Transfers: If we are involved in a merger, acquisition, financing due diligence, reorganization, bankruptcy, receivership, sale of all or a portion of our assets, or transition of service to another provider, your Personal Data and other information may be shared in the diligence process with counterparties and others assisting with the transaction and transferred to a successor or affiliate as part of that transaction along with other assets.
Legal Requirements: If required to do so by law or in the good faith belief that such action is necessary to (i) comply with legal or regulatory obligations, (ii) protect and defend our rights or property, (iii) prevent fraud, (iv) act in urgent circumstances to protect the personal safety of users of the Site, or the public, or (v) protect against legal liability.",,,,
Relativity Space,"Except as provided below, we do not share your personal information with third parties.   

Service Providers. We may share any personal information we collect about you with our third-party service providers. The categories of service providers (processors) to whom we entrust personal information include: IT and related services; information and services; employment application service providers; payment processors; customer service providers; manufacturers; and other third parties to support the provision of the Services such as the FAA and other similar agencies.  

Business Partners. We may provide personal information to business partners with whom we jointly offer products or services. In such cases, our business partner’s name will appear along with ours.  

Affiliates. We may share personal information with our affiliated companies.  

Advertising Partners.  Through our Services and on social media sites, third party advertising partners may set Technologies and other tracking tools to collect information regarding your activities and your device (e.g., your IP address, mobile identifiers, page(s) visited, location, time of day). We may also combine and share such information and other information (such as demographic information and past purchase history) with third party advertising partners. These advertising partners may use this information (and similar information collected from other websites) for purposes of delivering targeted advertisements to you when you visit third party websites within their networks. This practice is commonly referred to as “interest-based advertising” or “online behavioral advertising.” We may allow access to other data collected by the Services to share information that may be useful, relevant, valuable or otherwise of interest to you. If you prefer not to share your personal information with third party advertising partners, you may follow the instructions below.  

Disclosures to Protect Us or Others. We may access, preserve, and disclose any information we store associated with you to external parties if we, in good faith, believe doing so is required or appropriate to: comply with law enforcement or national security requests and legal process, such as a court order or subpoena; protect your, our or others’ rights, property, or safety; enforce our policies or contracts; collect amounts owed to us; or assist with an investigation or prosecution of suspected or actual illegal activity. 

Disclosure in the Event of Merger, Sale, or Other Asset Transfers. If we are involved in a merger, acquisition, financing due diligence, reorganization, bankruptcy, receivership, purchase or sale of assets, or transition of service to another provider, then your information may be sold or transferred as part of such a transaction, as permitted by law and/or contract.  

International Data Transfers. You agree that all information processed by us may be transferred, processed, and stored anywhere in the world, including but not limited to, the United States or other countries, which may have data protection laws that are different from the laws where you live. We have taken appropriate safeguards to require that your personal information will remain protected and require our third-party service providers and partners to have appropriate safeguards as well. Further details can be provided upon request.  

","Except as provided below, we do not share your personal information with third parties.   

Service Providers. We may share any personal information we collect about you with our third-party service providers. The categories of service providers (processors) to whom we entrust personal information include: IT and related services; information and services; employment application service providers; payment processors; customer service providers; manufacturers; and other third parties to support the provision of the Services such as the FAA and other similar agencies.  

Business Partners. We may provide personal information to business partners with whom we jointly offer products or services. In such cases, our business partner’s name will appear along with ours.  

Affiliates. We may share personal information with our affiliated companies.  

Advertising Partners.  Through our Services and on social media sites, third party advertising partners may set Technologies and other tracking tools to collect information regarding your activities and your device (e.g., your IP address, mobile identifiers, page(s) visited, location, time of day). We may also combine and share such information and other information (such as demographic information and past purchase history) with third party advertising partners. These advertising partners may use this information (and similar information collected from other websites) for purposes of delivering targeted advertisements to you when you visit third party websites within their networks. This practice is commonly referred to as “interest-based advertising” or “online behavioral advertising.” We may allow access to other data collected by the Services to share information that may be useful, relevant, valuable or otherwise of interest to you. If you prefer not to share your personal information with third party advertising partners, you may follow the instructions below.  

Disclosures to Protect Us or Others. We may access, preserve, and disclose any information we store associated with you to external parties if we, in good faith, believe doing so is required or appropriate to: comply with law enforcement or national security requests and legal process, such as a court order or subpoena; protect your, our or others’ rights, property, or safety; enforce our policies or contracts; collect amounts owed to us; or assist with an investigation or prosecution of suspected or actual illegal activity. 

Disclosure in the Event of Merger, Sale, or Other Asset Transfers. If we are involved in a merger, acquisition, financing due diligence, reorganization, bankruptcy, receivership, purchase or sale of assets, or transition of service to another provider, then your information may be sold or transferred as part of such a transaction, as permitted by law and/or contract.  

International Data Transfers. You agree that all information processed by us may be transferred, processed, and stored anywhere in the world, including but not limited to, the United States or other countries, which may have data protection laws that are different from the laws where you live. We have taken appropriate safeguards to require that your personal information will remain protected and require our third-party service providers and partners to have appropriate safeguards as well. Further details can be provided upon request.  

",,,,
Innovaccer,"We may share any information that you provide through the Services in the following circumstances.

SUBSIDIARIES AND AFFILIATES

We may share any information we receive with our subsidiaries and affiliates worldwide for any purposes described in this Privacy Policy.

VENDORS AND SERVICE PROVIDERS

We may share any information we receive with third-party vendors and service providers who facilitate one or more aspects of the business, product and service operations that we provide to you through the Services (e.g., search technology, discussion boards, bill collection, affiliate and rewards programs).

ANALYTICS PARTNERS

We use analytics services such as Inspectlet to collect and process certain analytics data. These services may also collection information about your use of other websites, apps, and online resources.

ADVERTISING PARTNERS

We work with third-party advertising partners to show you ads that we think may interest you. These advertising partners may set and access their own cookies, pixel tags and similar technologies on our Services and they may otherwise collect or have access to information about you which they may collect over time and across different online services. Some of our advertising partners are members of the Network Advertising Initiative or the Digital Advertising Alliance. If you do not wish to receive personalized ads, please visit their opt-out pages to learn about how you may opt out of receiving web-based personalized ads from member companies. You can access any settings offered by your mobile operating system to limit ad tracking, or you can install the AppChoices mobile app to learn more about how you may opt out of personalized ads in mobile apps.

OTHER USERS

Any Information that you voluntarily choose to include on or through the Services, including information in a publicly accessible area of the Services (such as a public profile page) or information you share with or allow to be shared with other users, will be available to anyone who has access to that content, including other users. We are not responsible for privacy practices of the other users who will view and use the posted information.

LEGAL REQUESTS

We cooperate with law enforcement and regulatory inquiries, as well as other third parties to enforce laws, such as intellectual property rights, fraud and other rights, to help protect you and the community from bad actors. Therefore, in response to a verified request by law enforcement or other government officials relating to a criminal investigation or alleged illegal activity and other legal process, we can (and you hereby authorize us to) disclose your name, city, state, telephone number, email address, user ID history, fraud complaints, and bidding and listing history without a subpoena. Further, we can (and you authorize us to) disclose information about you to protect your, our, or others’ rights, property, or safety, including disclosing your name, street address, city, state, zip code/pin code, country, phone number, email, and company name to intellectual property owners under a confidentiality agreement, as we in our sole discretion believe necessary or appropriate in connection with an investigation of fraud, intellectual property infringement, piracy, or other unlawful activity.

MERGER, SALE OF BUSINESS OR OTHER ASSET TRANSFERS

We may disclose and transfer information about you to service providers, advisors, potential transactional partners, or other third parties in connection with the consideration, negotiation, or completion of a corporate transaction in which we are acquired by or merged with another company or we sell, liquidate, or transfer all or a portion of our business or assets.

CONSENT

We may also disclose information from or about you or your devices with your permission. ... In the preceding twelve months, we have not sold any California resident’s Personal Information.","In the preceding twelve months, we have not sold any California resident’s Personal Information.",,,,
Flowcode,"We share your information with third parties as follows:

With Brands and Creators: We share information with Brands and Creators. For example, when we collect information about you in the context of your relationship with (or interaction with) a Brand or Creator, we may share that information with the Brand or Creator. We may also share personal information with Brands or Creators in other situations.
With Vendors: We may share your information with companies that provide services to us, including, without limitation, facilitating some aspects of our Sites or Services such as sending emails and fulfilling customer service requests.
With Affiliates: We may share information with other members of our corporate family for the purposes described in this Privacy Policy.
With Business Partners: Where we are permitted to do by applicable privacy laws and with your consent if required by law, we may share information with businesses with which we partner to offer you certain products, services, and promotions which may be of interest to you.
Legal Proceedings: We share information when we believe disclosure is appropriate due to a subpoena or similar investigative demand, a court order, or other request from a law enforcement or government agency; to establish or exercise our legal rights; to defend against legal claims; or as otherwise required by law;
Compliance: We share information when we believe disclosure is appropriate in connection with efforts to investigate, prevent, or take other action regarding illegal activity, suspected fraud or other wrongdoing; to protect and defend the rights, property or safety of our company, our users, our employees, or others; to comply with applicable law or cooperate with law enforcement; or to enforce our Services’ terms and conditions or other agreements or policies.
Corporate Transactions: We may disclose your information as part of, or to take steps in anticipation of, a sale of all or a portion of our business, a divestiture, merger, consolidation, or asset sale, a bankruptcy, or other significant corporate event. ... dtx does not “sell” and has not “sold” personal information in the way those terms are conventionally defined. For example, we do not sell email lists or any other personal information in exchange for monetary value from a purchaser. However, the CCPA defines a “sale” in very specific terms, that may encompass some situations when a website or application uses third-party cookies and similar technology for its own analytics or advertising purposes, even when the website or application pays the third-party provider (not vice versa). dtx, like most companies, does use those sorts of services.

For that reason, prior to the effective date of this Privacy Policy, dtx is considered to have engaged in such “sales” (as defined in the CCPA) of what the CCPA calls “identifiers” (like IP addresses), “internet or other electronic network activity information” (like information regarding an individual’s browsing interactions with a website or application), and “commercial information” (like the fact that a browser visited a particular page) to our analytics and advertising vendors. These practices continue today.

","However, the CCPA defines a “sale” in very specific terms, that may encompass some situations when a website or application uses third-party cookies and similar technology for its own analytics or advertising purposes, even when the website or application pays the third-party provider (not vice versa). dtx, like most companies, does use those sorts of services.

For that reason, prior to the effective date of this Privacy Policy, dtx is considered to have engaged in such “sales” (as defined in the CCPA) of what the CCPA calls “identifiers” (like IP addresses), “internet or other electronic network activity information” (like information regarding an individual’s browsing interactions with a website or application), and “commercial information” (like the fact that a browser visited a particular page) to our analytics and advertising vendors. These practices continue today.",,,,
