Website,Section,Relevant Sentences,Classification from Model,,,
Ramp,"We share information we collect, including information that identifies you, in accordance with the practices described in this Privacy Policy. The categories of parties with whom we share information include:

Service Providers. We share information with service providers that process information on our behalf. Service providers assist us with services such as payment processing, Card services, data analytics, website hosting, and technical support. We contractually prohibit our service providers from retaining, using, or disclosing information about you for any purpose other than performing the services for us, although we may permit them to use information that does not identify you (including information that has been aggregated or de-identified) for any purpose except as prohibited by applicable law or contractual obligation.

Affiliates. We share information with our affiliates and related entities, including where they act as our service providers or for their own internal purposes.

Business Customers. We share information with our business customers to provide services on their behalf. For example, we share information with our business customers to facilitate your Ramp Account purchases, maintain and administer your Cards, respond to your and their questions, comply with your and their requests, and otherwise comply with the law. In addition, business customer administrators and managers will see certain information you submit through your Ramp Account, such as receipts uploaded, or requests submitted. Our business customers are independent entities and their processing of information is subject to their own privacy policies.

Identity Verification Services. We share information as necessary to verify your identity.

Card-issuing Partners. We share information with banks in connection with providing Card services to you.

Credit Reporting Agencies and Other Financial Information Providers. We share information about you and your account with credit reporting agencies to verify information about your business, to report on your business's performance, and to report late payments, missed payments, or other defaults.

Ramp Rewards. We share information about you and your Ramp Account as necessary to determine your eligibility and to facilitate the rewards program effectively.

Marketing and Advertising. We share information collected through the Service with vendors or other parties for marketing and advertising related purposes. These parties may act as our service providers, or in certain contexts, independently decide how to process your information. For more information, see the ""Analytics and Advertising"" section below.

Mergers and Acquisition. We share information in connection with, or during negotiations of, any proposed or actual merger, purchase, sale or any other type of acquisition or business combination of all or any portion of our assets, or transfer of all or a portion of our business to another business.

Security and Compelled Disclosure. We share information to comply with the law, regulations, payment network rules, or other legal process, and where required in response to lawful requests by public authorities, including to meet national security or law enforcement requirements. We also share information with regulators, law enforcement, financial services providers, and other authorized third parties as required by law. We will also share information to protect the rights, property, life, health, security and safety of us, the Service, the Product, or anyone else.

Referrals and Joint Marketing. We share information with our partners in connection with facilitating referral partnerships or engaging in joint marketing activities. For example, if you were referred to our Service or Product through a referral partner, we share information with our referral partner to calculate the referral fee.

At your Request. We share information at your request or direction, such as if you direct us to connect your Ramp Account to a third party integration.

With Notice to You and Your Consent. We may otherwise share information after providing notice to you and obtaining your consent.

Notwithstanding the above, we may share information that does not identify you (including information that has been aggregated or de-identified) for any purpose except as prohibited by law or contractual obligation applicable to us. ... We do not sell information collected through the Service or Product.","We share information we collect, including information that identifies you, in accordance with the practices described in this Privacy Policy. The categories of parties with whom we share information include:

Service Providers. We share information with service providers that process information on our behalf. Service providers assist us with services such as payment processing, Card services, data analytics, website hosting, and technical support. We contractually prohibit our service providers from retaining, using, or disclosing information about you for any purpose other than performing the services for us, although we may permit them to use information that does not identify you (including information that has been aggregated or de-identified) for any purpose except as prohibited by applicable law or contractual obligation.

Affiliates. We share information with our affiliates and related entities, including where they act as our service providers or for their own internal purposes.

Business Customers. We share information with our business customers to provide services on their behalf. For example, we share information with our business customers to facilitate your Ramp Account purchases, maintain and administer your Cards, respond to your and their questions, comply with your and their requests, and otherwise comply with the law. In addition, business customer administrators and managers will see certain information you submit through your Ramp Account, such as receipts uploaded, or requests submitted. Our business customers are independent entities and their processing of information is subject to their own privacy policies.

Identity Verification Services. We share information as necessary to verify your identity.

Card-issuing Partners. We share information with banks in connection with providing Card services to you.

Credit Reporting Agencies and Other Financial Information Providers. We share information about you and your account with credit reporting agencies to verify information about your business, to report on your business's performance, and to report late payments, missed payments, or other defaults.

Ramp Rewards. We share information about you and your Ramp Account as necessary to determine your eligibility and to facilitate the rewards program effectively.

Marketing and Advertising. We share information collected through the Service with vendors or other parties for marketing and advertising related purposes. These parties may act as our service providers, or in certain contexts, independently decide how to process your information. For more information, see the ""Analytics and Advertising"" section below.

Mergers and Acquisition. We share information in connection with, or during negotiations of, any proposed or actual merger, purchase, sale or any other type of acquisition or business combination of all or any portion of our assets, or transfer of all or a portion of our business to another business.

Security and Compelled Disclosure. We share information to comply with the law, regulations, payment network rules, or other legal process, and where required in response to lawful requests by public authorities, including to meet national security or law enforcement requirements. We also share information with regulators, law enforcement, financial services providers, and other authorized third parties as required by law. We will also share information to protect the rights, property, life, health, security and safety of us, the Service, the Product, or anyone else.

Referrals and Joint Marketing. We share information with our partners in connection with facilitating referral partnerships or engaging in joint marketing activities. For example, if you were referred to our Service or Product through a referral partner, we share information with our referral partner to calculate the referral fee.

At your Request. We share information at your request or direction, such as if you direct us to connect your Ramp Account to a third party integration.

With Notice to You and Your Consent. We may otherwise share information after providing notice to you and obtaining your consent.

Notwithstanding the above, we may share information that does not identify you (including information that has been aggregated or de-identified) for any purpose except as prohibited by law or contractual obligation applicable to us. ... We do not sell information collected through the Service or Product.",,,,
GitLab,"We may share each of the categories of personal information we collect with the types of third parties described below, for the following business purposes:

Sharing with Users and the Public: We may share your personal information with other users of the Services and with the public if you choose to make your SaaS Profile public. You have control over what information is public. To change your settings, go to User Settings in your profile. You should also be aware that any information you share as part of a project, blog, website etc. may be publicly available and you should consider this carefully when interacting with the Services.

Sharing with Managed Accounts and Administrators: If you have created a GitLab account with your corporate email address, we may share your personal information with your Company if your Company enters into a commercial relationship with GitLab. If this happens, then your use of the software and your account is subject to the terms and any data protection agreement between your Company and GitLab.

In addition, if you choose to become a member of a project, your username, email address, IP address, the date when access was granted, the date when access expires, and your access role will be shared with the group owners of that project.

Sharing with Service Providers: We share your personal information with our service providers. These are companies who provide services on our behalf, such as hosting our Services, marketing, advertising, social, analytics, support ticketing, credit card processing, security and other such similar services. These companies are subject to contractual requirements that govern the security and confidentiality of your information.

For example, we use analytics providers, such as Google Analytics, to help us understand the operation and performance of our Services. To learn about how Google uses and shares data it collects through its services, please visit https://www.google.com/policies/privacy/partners/.

Sharing with Partners and Resellers: GitLab works with third parties who provide sales, consulting, support and technical services for our Services. Where permitted and with your consent (if required), we may share your data with these partners and resellers.

Sharing with Affiliated Companies: GitLab will share information collected with companies owned and operated by us.

Sharing for Fraud and Prevention Abuse: We may share your information when we have a good faith belief that the disclosure is necessary to prevent fraud, abuse of our services, defend against attacks, and to protect the safety of GitLab and our users.

Law Enforcement: GitLab may disclose personal information or other information we collect about you to law enforcement if required in response to a valid subpoena, court order, search warrant, a similar government order, or when we believe in good faith that disclosure is necessary to comply with our legal obligations, to protect our property or rights, or those of third parties or the public at large.

Merger or Acquisition: We may share your personal information if we are involved in a merger, sale, or acquisition of corporate entities or business units. If any such change of ownership happens, we will ensure that it is under terms that preserve the confidentiality of your personal information, and we will notify you on our website or by email before any transfer of your personal information.
... GitLab does not sell your personal information, as defined under CCPA, and has not done so for the past 12 months.","GitLab does not sell your personal information, as defined under CCPA, and has not done so for the past 12 months.",,,,
MasterClass,"MasterClass will share your information in the following ways:

Affiliates and Subsidiaries. We may share information we collect within the Yanka Industries family of companies to deliver products and services to you, ensure a consistent level of service, and enhance our products, services, and your customer experience.

Service Providers. We provide access to or share your information with select third parties who perform services on our behalf. They have access to perform these services but are prohibited from using your information for other purposes. They provide a variety of services to us, including billing, sales, marketing, product content and features, advertising, analytics, research, customer service, data storage, security, fraud prevention, payment processing, and legal services.

Protection of MasterClass and Others. By using the Services, you acknowledge and agree that we may access, retain and disclose the information we collect and maintain about you if required to do so by law or in a good faith belief that such access, retention or disclosure is reasonably necessary to: (a) comply with legal process (e.g. a subpoena or court order); (b) enforce our Terms of Service, this Privacy Policy, or other contracts with you, including investigation of potential violations thereof; (c) respond to claims that any content violates the rights of third parties; (d) respond to your requests for customer service; and/or (e) protect the rights, property or personal safety of MasterClass, its agents and affiliates, its users and/or the public. This includes exchanging information with other companies and organizations for fraud protection, and spam/malware prevention, and similar purposes.

Business Transfers. As we continue to develop our business, we may buy, merge, or partner with other companies. In such transactions (including in contemplation of such transactions), user information may be among the transferred assets. If a portion or all of our assets are sold or transferred to a third-party, customer information (including your email address) would likely be one of the transferred business assets. If such transfer is subject to additional mandatory restrictions under applicable laws, we will comply with such restrictions.

Public Forums. Certain features of our Services make it possible for you to share comments publicly with other users. Any information that you submit through such features is not confidential, and we may use it for any purpose (including in testimonials or other marketing materials). Any information you post openly in these ways will be available to the public at large and potentially accessible through third-party search engines. Accordingly, please take care when using these features.

Aggregate/Anonymous Information. From time to time, we may share Aggregate/Anonymous Information about use of the Services, such as by publishing a report on usage trends. The sharing of such data is unrestricted. ... MasterClass allows some of our advertising partners to collect certain pieces of information from our site visitors, such as device identifiers, cookies, advertising IDs, IP addresses, and usage activity, so that we and our partners can deliver ads that are more relevant to you. This type of information sharing with our advertising partners may be considered a ""sale"" under the CCPA. ","MasterClass allows some of our advertising partners to collect certain pieces of information from our site visitors, such as device identifiers, cookies, advertising IDs, IP addresses, and usage activity, so that we and our partners can deliver ads that are more relevant to you. This type of information sharing with our advertising partners may be considered a ""sale"" under the CCPA. ",,,,
Medable,"When you have provided Personal Data to us for a particular purpose, we may disclose your information to other companies that we have engaged to assist us in fulfilling your request. This may include, but is not limited to fulfillment houses, billing services, transaction managers, credit verification services, and other third-party service providers. We may also disclose any of your Personal Data to law enforcement or other appropriate third parties in connection with criminal investigations, investigation of fraud, infringement of intellectual property rights, or other suspected illegal activities, or as otherwise may be required by applicable law, or, as we deem necessary in our sole discretion, in order to protect the legitimate legal and business interests of Company.



We sometimes share general, demographic, or aggregated (non-identifiable) information with third parties about our user base, but that information does not include any Personal Data.



Your Personal Data may also be disclosed if Company assigns all of its rights and obligations regarding the use of your Personal Data at the time of a bankruptcy, merger, acquisition, sale of all or substantially all of Company’s assets to a subsequent owner or operator, or similar event.



To the extent we collect any aggregated anonymous information, we may share that information and information derived from the aggregated anonymous information with our business partners. ... Medable does not sell consumer data for monetary or other valuable consideration.",Medable does not sell consumer data for monetary or other valuable consideration.,,,,
Guild Education,"In addition to the specific situations discussed elsewhere in this Privacy Policy, Guild may share your Personal Information in the following circumstances: 

Service Providers. We may from time to time engage service providers to perform functions on our behalf such as supporting our Services, conducting our business, processing payment transactions, managing our marketing communications, recruitment and/or admissions process, tracking student enrollment and student performance, or otherwise providing the Services to you. We may share your Personal Information with such service providers, so long as those parties agree to keep your Personal Information confidential.
Behavioral-Based Advertising. We participate in behavioral-based advertising. This means that a third party may use technology (e.g., a cookie) to collect information about your use of our Website so that we can provide advertising about goods and services tailored to your interest. For example, we use third party providers to serve ads or collect data on our behalf across the Internet and sometimes on this Website. Some of these third-party providers may collect Personal Information about your visits to our Website, and your interaction with devices and Services to tailor marketing messages on this Website and other sites or to trigger real-time interaction, customize this Website or enhance your profile. Some of these third-party providers may be able to collect Personal Information that you share with this Website via a web form automatically and prior to your pressing a submit button; and they may be able to use Personal Information from your visits to this Website to send marketing messages to you in a way that may personally identify you. This information is collected using a cookie, a javascript tag, or pixel, or cross-device identification methods. The Personal Information collected by these third-party providers may include your device’s IP address, user agent, email addresses (where hashed or otherwise rendered pseudonymous) and other user and device-level pseudonymous information. Please keep in mind that your browser settings may not permit you to control the technologies utilized by these third-party companies.
Partnering Educational Institutions and Partnering Employers. When you apply to a Program offered by one of our partnering educational institutions, we may transfer your Personal Information to such partnering institution in connection with providing Programs and Services to you, including to facilitate the application, admissions and enrollment process, apply for academic credit for you, track your participation in Programs, or fulfill our contracted responsibilities to a partnering institutions or partnering employer. We may also transfer Personal Information to a partnering employer in connection with providing Programs and Services to you, including to assess benefits eligibility, facilitate the enrollment process, to provide information on your academic achievements and progress, enable you to receive tuition assistance and reimbursement, direct your application to a partnering employer, and facilitate your application to a job opportunity.
Related Companies and M&A Transactions. We may share your Personal Information with companies that are affiliated with us (that is, that control, are controlled by, or are under common control with us). We reserve the right to disclose and transfer your Personal Information in connection with the sale of all or a part of our business, a corporate merger or other restructuring. 
Legal Compliance. We may also disclose your Personal Information, usage information and device identifier (such as IP address) to third parties to comply with a legal obligation, to respond to a valid government or law enforcement request such as a warrant or subpoena, to enforce our Services-related agreements or other applicable policies, to respond to an emergency, or to protect the rights, property, safety or security of third parties, Users of our Services or the public.
Social Networking. The Services may offer you the ability to share your Personal Information through a social networking site (e.g., Facebook, Twitter), using such site’s integrated tools (e.g., Facebook “Like” button, or Twitter “Tweet” button). The use of such integrated tools enables you to share Personal Information about yourself with other individuals or the public, depending on the settings that you have established with such social networking site. For more information about the purpose and scope of data collection and use in connection with such social networking site or a site’s integrated tools, please visit the privacy policies of the entities that provide these social networking sites.
Public Forum and Messaging. The Services may provide you with the opportunity to post comments, messages, or reviews in a public forum. If you decide to submit Personal Information at these locations, that information will be available to other Users of the Services.
Referrals. Users may recommend other Users by providing their contact information or selecting friends from a social networking site.
Consent. We may ask if you would like us to share your Personal Information with other unaffiliated third parties who are not described elsewhere in this Privacy Policy, and we may do so with your consent. ... If you are 16 years of age or older, you have the right to direct us to not sell your Personal Information at any time. ","If you are 16 years of age or older, you have the right to direct us to not sell your Personal Information at any time. ",,,,
Overtime,"We ask you for certain kinds of personal information in order to provide you with the services you request and to process and deliver your order. We also may use your personal information to provide you with customized communications and keep you updated on the latest promotions or products that may interest you.

In addition, our site utilizes 'cookies.' Cookies do not gather any of your personally identifiable information. They do allow us to provide you with a more personalized shopping experience and enable you to fully interact with and complete your transaction on our site.

We may partner with companies to display ads on third-party sites. The partners' applications may use cookies and other code to measure the effectiveness of our ads and to determine the display of ads to you based on your interests both on our site, as well as third party sites you may visit. The information collected is always anonymous, and does not enable any third party to identify you individually","We ask you for certain kinds of personal information in order to provide you with the services you request and to process and deliver your order. We also may use your personal information to provide you with customized communications and keep you updated on the latest promotions or products that may interest you.

In addition, our site utilizes 'cookies.' Cookies do not gather any of your personally identifiable information. They do allow us to provide you with a more personalized shopping experience and enable you to fully interact with and complete your transaction on our site.

We may partner with companies to display ads on third-party sites. The partners' applications may use cookies and other code to measure the effectiveness of our ads and to determine the display of ads to you based on your interests both on our site, as well as third party sites you may visit. The information collected is always anonymous, and does not enable any third party to identify you individually",,,,
